{
  "version": 1,
  "shape": "dune",
  "delivery": "vertical",
  "root": "src",
  "modules": [
    {
      "id": "auth",
      "purpose": "login and sessions",
      "folder": "src/lib/auth",
      "interface": "src/lib/auth/api.ts",
      "allowed_paths": [
        "src/lib/auth/**",
        "test/auth/**"
      ],
      "depends_on": []
    }
  ],
  "scaffold_first": true,
  "current_module_id": "auth"
}
